comentario,etiqueta
"Está aceptable.",1
"No me resolvieron nada.",0
"El servicio fue excelente.",2
"Tardaron en atenderme.",1
"Me ignoraron.",0
"Me dieron un buen diagnóstico.",2
"Esperaba más.",1
"El trato fue muy malo.",0
"La consulta fue útil.",2
"Servicio promedio.",1
"Los médicos no fueron claros.",0
"Todo salió bien.",2
"La atención estuvo regular.",1
"La cita fue inútil.",0
"Me atendieron rápido.",2
"Hubo mucha espera.",1
"No recomendaría el servicio.",0
"El equipo médico fue amable.",2
"Podría ser más eficiente.",1
"Me hicieron esperar demasiado.",0
"El sistema de citas es fácil.",2
"Atención decente.",1
"No recibí respuestas claras.",0
"El trato fue bueno.",2
"No fue lo que esperaba.",1
"Me hicieron perder tiempo.",0
"El doctor fue muy profesional.",2
"Todo estuvo bien organizado.",2
"El personal fue educado.",2
"La consulta estuvo bien.",1
"La gestión de turnos es lenta.",1
"No solucionaron mi problema.",0
"Me explicaron todo bien.",2
"El servicio es funcional.",1
"La espera es frustrante.",0
"Recibí buen cuidado.",2
"Servicio promedio, nada especial.",1
"Me dijeron que volviera otro día.",0
"Me atendieron rápido.",2
"La consulta fue útil.",2
"La atención estuvo bien.",2
"Me ayudaron con mi problema.",2
"El trato fue amable.",2
"Me explicaron todo con claridad.",2
"Recibí buen cuidado.",2
"El servicio fue eficiente.",2
"Fue una buena experiencia.",2
"La atención médica fue profesional.",2
"Estuvo bien.",1
"El servicio es aceptable.",1
"Normal, sin problemas.",1
"Me atendieron, pero tardaron.",1
"Podría mejorar.",1
"Fue una consulta promedio.",1
"La consulta estuvo regular.",1
"Servicio correcto.",1
"Atención decente.",1
"La espera fue larga.",1
"La atención fue lenta.",0
"No recibí ayuda suficiente.",0
"La espera fue frustrante.",0
"No me atendieron bien.",0
"El servicio fue deficiente.",0
"No me resolvieron nada.",0
"El trato no fue bueno.",0
"La gestión de citas es complicada.",0
"No solucionaron mi problema.",0
"No me dieron un diagnóstico claro.",0
"Me ignoraron.",0
"No recomendaría el servicio.",0
"Me hicieron esperar mucho.",0
"No fue lo que esperaba.",0
"El servicio necesita mejorar.",0
"La atención médica no fue suficiente.",0
"Me dijeron que volviera otro día.",0
"No encontré ayuda real.",0
"El personal no fue atento.",0
"Sentí que no me tomaron en serio.",0
"Fue decepcionante.",0
"La consulta no sirvió.",0
"Necesito otra opinión médica.",0
"El sistema de citas es un desastre.",0
"Fue una mala experiencia.",0
"Los médicos no fueron claros.",0
"No me dieron seguimiento.",0
"La atención no me convenció.",0
"Me sentí ignorado.",0
"Me atendieron bien.",2
"El servicio fue rápido.",2
"La consulta fue útil.",2
"Me explicaron todo con claridad.",2
"La atención médica fue profesional.",2
"Fue una buena experiencia.",2
"Los médicos son atentos.",2
"La espera fue corta.",2
"Recibí un buen diagnóstico.",2
"Me ayudaron con mi problema.",2
"El trato fue excelente.",2
"El doctor fue amable.",2
"Sentí confianza en la consulta.",2
"Me dieron recomendaciones útiles.",2
"La atención médica fue eficiente.",2
"Volvería sin duda.",2
"Me hicieron sentir cómodo.",2
"Buena atención en urgencias.",2
"Las instalaciones están en buen estado.",2
"El sistema de citas es claro y fácil.",2
"Estuvo bien.",1
"Servicio normal, sin problemas.",1
"Los médicos explican bien, pero tardaron.",1
"Me atendieron, pero la espera fue larga.",1
"Podría mejorar.",1
"Fue una consulta promedio.",1
"La consulta estuvo regular.",1
"Atención decente.",1
"La atención médica es aceptable.",1
"Hubo demora, pero me atendieron bien.",1
"El trato fue bueno, pero esperaba más.",1
"El proceso de registro fue algo confuso.",1
"No fue lo que esperaba.",1
"El servicio es funcional, pero tiene fallas.",1
"La consulta estuvo bien, pero faltó información.",1
"El personal fue amable, pero la espera fue larga.",1
"Está aceptable.",1
"Las instalaciones podrían mejorar.",1
"Me atendieron, pero no resolvieron mi duda.",1
"La gestión de citas puede ser mejor.",1
"La espera fue larga.",0
"No me atendieron bien.",0
"No me resolvieron nada.",0
"El servicio fue deficiente.",0
"El trato no fue bueno.",0
"La consulta no sirvió.",0
"No recibí ayuda suficiente.",0
"La gestión de citas es un desastre.",0
"Me hicieron esperar demasiado.",0
"Sentí que no me tomaron en serio.",0
"Fue decepcionante.",0
"Necesito otra opinión médica.",0
"No me dieron seguimiento.",0
"No recomendaría el servicio.",0
"La atención médica no fue suficiente.",0
"No encontré ayuda real.",0
"El personal no fue atento.",0
"La consulta no fue clara.",0
"La atención fue fría e impersonal.",0
"No me explicaron bien el diagnóstico.",0
"Me dijeron que volviera otro día.",0
"La consulta no aportó nada nuevo.",0
"No solucionaron mi problema.",0
"La espera fue frustrante.",0
"Me ignoraron.",0
"No fue una buena experiencia.",0
"Tuve que buscar otro médico.",0
"No me dieron información útil.",0
"El sistema de citas no funciona bien.",0
"La atención en urgencias fue lenta.",0
"Sentí que no me escucharon.",0
"La consulta no me ayudó.",0
"No me atendieron como esperaba.",0
"El médico no mostró interés en mi caso.",0
"La atención médica necesita mejorar.",0
"La experiencia fue decepcionante.",0
"La consulta fue muy breve y poco informativa.",0
"Me sentí ignorado.",0
"El servicio no es confiable.",0
"No obtuve respuestas claras.",0
"Me dieron un diagnóstico incorrecto.",0
"La atención fue apresurada.",0
"No recibí orientación suficiente.",0
"La consulta no resolvió mis dudas.",0
"Necesitan mejorar su trato a los pacientes.",0
"El doctor no parecía seguro de su diagnóstico.",0
"La atención fue desorganizada.",0
"No sentí confianza en el médico.",0
"La gestión de citas es terrible.",0
"La consulta no sirvió para nada.",0
"El servicio médico no me ayudó.",0
"La experiencia fue frustrante.",0
"No recomendaría el centro médico.",0